results/model_coefficients_table.csv

feature,coef,stderr,tstat,pvalue,ci_lower,ci_upper,vif
Intercept (β₀),-6.238631194345089,0.0001763124666350723,-35383.94824489451,0.0,-6.23897679312728,-6.238285595562898,
study_hours_per_day,4.3163789319297186,9.261827185776167e-06,466039.6750393474,0.0,4.316360777364376,4.316397086495061,1.0005693008395782
focus_score,0.32372814523720606,1.2538979743343487e-06,258177.42102108602,0.0,0.32372568740979774,0.3237306030646144,1.0002414715130277
sleep_hours,2.697744256984914,1.2450661044948717e-05,216674.78114179324,0.0,2.697719851828678,2.69776866214115,1.000091536999126
phone_usage_hours,-1.6186305621944008,7.641506527217746e-06,-211820.87019478608,0.0,-1.6186455406891171,-1.6186155836996845,1.0001529958667117
stress_level,-1.079080274644788,8.828554020716742e-06,-122226.16207735267,0.0,-1.0790975799299802,-1.079062969359596,1.0001925119734916
attendance_percentage,0.16186167445773236,1.457127912688559e-06,111082.68055827715,0.0,0.16185881826927484,0.16186453064618989,1.000507225120596

README.md

### 最優模型迴歸方程式與係數推論 ($k = 6$)

$$\begin{aligned}
\widehat{\text{Productivity Score}} = &-6.2386 \\
&+ 4.3164 \times (\text{study\_hours\_per\_day}) \\
&+ 0.3237 \times (\text{focus\_score}) \\
&+ 2.6977 \times (\text{sleep\_hours}) \\
&- 1.6186 \times (\text{phone\_usage\_hours}) \\
&- 1.0791 \times (\text{stress\_level}) \\
&+ 0.1619 \times (\text{attendance\_percentage})
\end{aligned}$$